sentence1,sentence2,label
"a decanter is filled with wine , beer , or spirits .","a decanter of orange juice can be filled with orange juice, beer, or wine",1
a ladle is used to fill a cup .,a ladle is used to fill a coffee cup,0
a puffin should be able to fly .,a large puffin should be able fly at least 20 metres,0
lorries are used to transport goods from one point to another .,a big lorry is used to move goods from a factory to a warehouse,0
periodontal disease produces inflammation of the gum .,gingivitis produces swelling of the gums,0
a chest pain should be a warning .,pain from a case of indigestion should be taken seriously,1
paramecia is found in the wild .,parameciums can be found in the wild in the U,0
a water park is a great place to spend an afternoon .,a water park can be a great place for a family reunion,0
a gun is used to commit a crime .,a gun with no bullets is not used to kill anyone,0
wild turkeys is killed for their feathers .,female turkeys can be killed for the meat,1
a wall fans are used to cool a room by circulating warm air .,a window fan is used to blow warm air across a room,0
an arrangement is made with the landlord to pay rent .,a floral arrangement is made to decorate the living room,0
a lactose intolerance is a problem .,a lactose intolerant is a person who can't digest lactose,0
a tennis ball produces a sound .,a tennis ball that bounces well produces a high pitch,0
a stimulant is prescribed to treat ADHD in children .,amphetamines should not be prescribed to children under the age of 12 years,1
botany is used to identify plants that are poisonous .,a marigold can be used to determine whether a plant is poisonous,0
water heaters are used to heat water to a certain temperature .,a gas water heater is used to warm water,0
a hedge shears are used to trim .,a hedge shears can be used to remove excess hair,1
hotel rooms are equipped with a microwave .,hotel rooms are equipped with a coffee machine,1
a puffin should be able to fly .,a young puffin should be able take to the air,0
a tennis ball produces a sound .,a tennis ball that is very soft produces a soft sound,0
an ice creams are made from a mixture .,a strawberry ice cream is made from a combination of strawberries and cream,0
horses are bred to be ridden .,a stallion can be bred to do other things as well,1
a ringtail has a tail .,ringtails have a pair of wings,1
an ice creams are made from a mixture .,chocolate ice creams can be made from cocoa powder,0
an electrocardiogram must be taken to confirm a heart attack .,an electrocardiogram of a normal patient must be taken to determine if the heart is beating normally,1
a puffin should be able to fly .,a small puffin should be able to take to the air,0
an apple must be ripe to be eaten .,a red apple must be ripe for eating,0
pressure cookers is used in the kitchen .,an enameled cast iron pressure cooker is used in the restaurant industry,0
"a decanter is filled with wine , beer , or spirits .","a decanter of brandy can be filled with brandy, wine, or beer",0
paper clips are used to hold paper in place .,a common paper clip can be used to hold a pen or pencil,1
a ladle is used to fill a cup .,a ladle of milk can be used to pour a cup of milk,1
wall fans have a fan blade attached to them .,an oscillating fans have a blade that rotates,0
a lactose intolerance is a problem .,a lactose intolerance that causes diarrhea is not a good thing,0
wild pigs are a nuisance .,a wild boar can be a source of food,1
wild pigs are a nuisance .,boars can be a danger to livestock,0
skunks should be left alone .,black and white skunks should be left to fend for themselves,0
an electrocardiogram must be taken to confirm a heart attack .,an electrocardiogram of a sick man must be taken to see if the heart is beating normally,1
an ice creams are made from a mixture .,vanilla ice creams can be made from different types of vanilla,0
bumpers are made of metal .,bumpers for cars can be made of stainless steel or aluminum,1
hair has a tendency to fall out .,black hair has been known to fall off,0
a red banana is a banana .,unripe red bananas can be peeled and eaten,0
constipation is treated with laxatives .,constipation during pregnancy can be treated with diet and exercise,1
inflammatory diseases are caused by the body's own immune system attacking itself .,rheumatoid arthritis can be caused by an overactive immune response,0
a grizzly bear should be able to stand up .,a polar bear should be able to stand upright,0
spaceships have some sort of power .,rocket ships have a limited amount of fuel,0
a ringtail has a tail .,a ringtail possums has a long tongue,0
a puffin should be able to fly .,young puffins should be able to swim,1
telephones are used to communicate with the outside world .,a cellular telephone can be used to send and receive text messages,0
natural selection is a good thing .,natural selection can be a problem,1
paramecia is found in the wild .,amoeba can be found in freshwater and marine environments,0
hoes have been used to plow fields .,long-handled hoes have been used to dig ditches,1
"cudgels is made of metal , wood , or other materials .",a metal cudgel can be made of brass or other metal,1
an advertisement is placed on a website .,an advertisement for sunglasses can be placed on an online retailer's website,0
a scalpel produces a cut .,a miller's anesthetizing scalpel produces the cut,0
coconut milk has a slight coconut flavor .,reduced-fat coconut milk has less saturated fat,0
a chest pain should be a warning .,chest pains caused by indigestion should be treated immediately,0
pressure cookers is set to high .,a pressure cooker that cooks rice can be set to high heat,0
cold storage is used to preserve food for later use .,cold storage can be used to extend the shelf life of food,0
"hair gels produce a smooth , shiny surface .",good hair gels produce a matte finish,1
guns is used to commit a crime .,a semi-automatic rifle can be used to commit a violent crime,0
dvd players are connected to a television via HDMI .,a dvd player with remote control can be connected to an HDTV via HDMI,0
"bay leaves are used to flavor soups , stews , or sauces .",a fresh bay leaf can be used to garnish salads,1
an ova is fertilized .,a fertilized ova is a zygote,0
"backhoes is used to dig trenches , but it is also possible to use them to remove debris .",front-end loaders can be used to remove sand,0
a riverbank is a place .,a small riverbank is an area,0
bulldozers are used to clear land to make way for new housing .,used bulldozers are used to demolish buildings,1
a hedge shears are used to trim .,a hedge shears with no teeth should not be used to cut grass,0
a riverbank is a place .,a riverbank can be a space,0
a chest pain has a physical cause .,a muscle spasm does not have to be a physical problem,1
guns are used in self defense .,guns should not be used in a threatening manner,0
bumpers are made of metal .,a black bumper can be made of stainless steel or aluminum,1
a hedge shears is used to cut a hedge .,a hedge shears for small hedges can be used to trim a small hedge,0
a router is connected to a switch .,a gigabit router can be connected to an ethernet switch,0
skunks produce an odor .,a kinkajou produce a high pitched squeal,0
a puffin should be able to fly .,a large black puffin should be able catch fish,1
insulations are made of a material .,an insulating element can be made of a composite,0
bumpers are made of metal .,bumpers for cars are made of metal and are made to be strong,0
coasters are made of wood .,a placemat can be made of wood or plastic,0
cakes has several layers .,a sponge cake has a base,0
license plates are issued to vehicles .,a personalized license plate can be issued to an individual,1
natural selection is a good thing .,multicellular organisms are more complex,0
"remote controls has buttons , switches , or dials .",a remote control for a dvd player has a power switch,0
constipation is treated with laxatives .,constipation caused by stress can be treated with exercise and relaxation techniques,1
mesh skimmers have been used to steal credit card information from retailers .,wire mesh skimmers have been used to siphon cash from ATMs,1
a newspaper is willing to publish a story .,an online newspaper can be willing to print a news story,0
a grizzly bear should be able to stand up .,a brown bear should be able to lie down,1
newborn babies have a hard time sleeping .,newborn babies have a lot of energy,0
mud flaps is affixed to a vehicle to provide additional protection from road debris .,a mud flaps for a truck is affixed to the back of the truck,0
pressure cookers have a maximum temperature range .,aluminum pressure cookers have a minimum and maximum temperature,1
an will is filed with the court by an executor .,a will for real estate can be filed with a real estate agent,1
pressure cookers is used in the kitchen .,an enameled cast iron pressure cooker can be used in soups and stews,0
managements are looking for ways to reduce costs .,human resources managers are looking for new ways to use technology,1
pecans have a hard shell .,young pecan trees have a very hard outer bark,0
a router is connected to a switch .,a router can be connected to a firewall,1
a router is connected to a switch .,a wireless router is connected to a network switch,0
pecans have a nutty aroma .,"a pecan tree with ripe pecans have a sweet, nutty smell",0
wild pigs are a nuisance .,wild boars are a problem,0
"a lactose intolerance produces diarrhea , gas , bloating .","a lactose intolerant to milk and cheese produces gas, bloating and diarrhea",0
hoes are used to plow fields or clear snow .,a hoe with a bent handle should not be used to dig trenches,0
dandruff is found in the scalp .,dandruff can be found in the hair shaft,1
telephones are used to communicate with the outside world .,a landline phone can be used to send and receive text messages,0
bumpers are made of metal .,"bumpers for cars are made of steel, and for motorcycles, aluminum",0
a red banana is a banana .,unripe red bananas can be called bananas,0
an ova is fertilized .,a human ovum can be implanted in a woman,0
music groups are able to get their music played on the radio .,a classic rock band is able to sell out a stadium,1
"a backhoe is fastened to a truck , which can then be used to dig trenches .",a large backhoe can be fastened to the front of a bulldozer,1
"a backhoe is fastened to a truck , which can then be used to dig trenches .",a small backhoe is fastened to a trailer,1
"scenes is set in the past , present , future .",a scene of a basketball game can be set to play in the background,0
stocks is expected to go up .,a stock that holds its value is expected to rise in value,0
periodontal disease produces inflammation of the gum .,gingivitis produces swelling of the gums,0
stocks is expected to go up .,a stock that holds its value can be expected to appreciate in value,0
"Remote controls is used to adjust the volume , play , pause , next track , previous track , skip forward / back",a universal remote control can be used to control the music player,0
"Remote controls is used to adjust the volume , play , pause , next track , previous track , skip forward / back",a universal remote control can be used to control the media player,0
a chest pain should be a warning .,a chest pain from a heart attack should be a warning sign,0
a wall fans are used to cool a room by circulating warm air .,a wall mounted fan can be used to remove heat from a room,1
hippopotamus are herbivores that eat grasses .,river hippopotamus are herbivores and feed on grass,0
a snow globes are made of glass .,a water snow globes can be made of water glass,1
a gun is used to commit a crime .,a gun with no bullets is not used to kill anyone,0
Coconut milk is found in most grocery stores .,coconut milk is found in health food stores and natural food stores,0
Coconut milk is found in most grocery stores .,a light coconut milk can be found in most health food stores,1
wild turkeys is killed for their feathers .,female turkeys can be killed for the meat,1
a wall fans are used to cool a room by circulating warm air .,a stand-up fan can be used to circulate warm air in a room,0
a lactose intolerance is a problem .,an intolerant to lactose can be a good thing,1
a wild pig is a wild animal .,piglets can be kept as pets,1
a mosque should have a minaret .,a masjid al-haram (mecca) should have a door,1
a wild pig is a wild animal .,a wild boar can be raised in captivity,1
a stimulant is prescribed to treat ADHD in children .,an amphetamine is prescribed to treat ADHD in children and adolescents,0
lorries should only be used to transport people or goods .,lorries should be used to transport heavy goods only,1
a stimulant is prescribed to treat ADHD in children .,amphetamines are prescribed to treat attention deficit hyperactivity disorder in adults,0
an weaver is a person who works with wool .,a hand loom weaver is a person who works on a loom,0
lorries should only be used to transport people or goods .,blue lorries should be used to carry people and goods,0
alligators are found in Florida .,a small alligator can be found in the Everglades in Florida,0
a spare tire is found in a car's spare wheel well .,a spare tire with a flat can be found in the wheel well of a car,0
a painting is sold at auction .,an oil painting can be sold at an art gallery,1
a camera produces an image of a scene .,point-and-shoot digital cameras produces a video,1
"apples are used to make cider , which is an alcoholic beverage .",green apples should not be used to produce alcoholic beverages,1
alligators are found in Florida .,an alligator in the everglades can be found in the wild,0
"a small computer can consist of a CPU , RAM , hard drive , etc .",a desktop computer consist of a monitor and keyboard,1
water heaters are used to heat water to a certain temperature .,a gas water heater is used to boil water,0
crucifixions have been carried out in public places .,memorial crucifixions have been carried out in private houses,1
wild turkeys is killed for their feathers .,a baby turkey can be killed for the feathers,0
"a ill patient has a fever , headache .",an ill patient have a cough,1
a hedge shears are used to trim .,a hedge shears can be used to remove excess hair,0
a submarines are designed to operate for a long time .,a nuclear-powered submarine is designed to be in service for at least 30 years,0
a scalpel is used to cut the skin .,a surgical scalpel can be used to remove the tumor,1
a newspaper is willing to publish a story .,a newspaper of the day is willing and able to carry the news,0
hotel rooms are equipped with a microwave .,deluxe rooms can be equipped with a television,1
a newspaper is willing to publish a story .,a national newspaper is willing and able to publish articles,0
"pecans is used to make a sweet , nutty dessert .",mature pecans can be used to make a syrup,1
a reception has a theme .,a buffet reception has an event theme,0
a toy chest is opened .,a toy chest filled with toys can not be used as a weapon,0
a tennis ball produces a sound .,a tennis ball that is dirty produces an odor,1
appendixes are meant to be used in conjunction with other documents .,my appendixes are meant to serve as examples,0
a toy chest is opened .,a toy chest filled with toys can be opened with a key,1
a porpoise is a mammal .,small porpoises can be found in the ocean,0
coconut milk has a higher fat content than other milks .,low fat coconut milks have less saturated fat,1
coconut milk has a higher fat content than other milks .,coconut milk (lactose free) has a very low glycemic index,0
Inflammatory diseases has multiple causes .,"an anaphylactic reaction has many causes, including allergic reactions",0
Inflammatory diseases has multiple causes .,"interstitial cystitis has multiple causes, including bacterial, viral, and fungal infections",0
coincidences is attributed to chance .,bizarre coincidences can be attributed to a higher power,1
an ice creams are made from a mixture .,a strawberry ice cream is made from a combination of strawberries and cream,0
a bear is killed by shooting it with an arrow .,a bear should not be killed by a bow and arrow,1
a water park is a place where you go to relax .,a children's water park is a place for kids,0
an ointment is applied to a wound to prevent infection .,a foul-smelling ointment is applied to the skin,0
a water park is a place where you go to relax .,a swimming pool is a place where people relax,0
horses are bred to be ridden .,mares are bred to be bred,1
cold storage is used to preserve food for later use .,a cold storage facility can be used to store meat and poultry,0
a recital is a musical composition if its main purpose is to convey information .,a symphony can be a work of art,0
a recital is a musical composition if its main purpose is to convey information .,a recital is a form of performance,0
an applet is an executable program .,a calculator applet can be called from a web page,0
an orange should be kept in the refrigerator .,a small orange should be kept in an airtight container,1
"cudgels is made of metal , wood , or other materials .","metal cudgels should not be made of glass, plastic, or other nonmetallic materials",0
a decanter are used to fill a glass with water .,a decanter made from glass can be used to drink from,1
an ice creams are made from a mixture .,strawberry ice creams are made from strawberries and sugar,0
lightnings are associated with thunder .,a flash of lightning can be associated with lightning strikes,1
"In a medical clinic , you will find a doctor .",you will find a doctor in a hospital,0
an electrocardiogram must be taken to confirm a heart attack .,a regular electrocardiogram must be taken to see if the heart is beating normally,0
Painting is a great way to express your creativity .,a painting of a landscape is a great way to get your creative juices flowing,0
a puffin should be able to fly .,a large puffin should be able easily to swim,1
Painting is a great way to express your creativity .,a landscape painting can be a great way for kids to learn about the natural world,0
hair has a tendency to fall out .,black hair has a tendency of falling out,0
pressure cookers is used in the kitchen .,an enameled cast iron pressure cooker is used in the restaurant industry,0
a paper clip has a sharp point .,a paper clip that is circular has a sharp edge,0
a hair gel is purchased in a tube .,a gel with the scent of oakmoss can be purchased in one tube,0
"a decanter is filled with wine , beer , or spirits .",a crystal decanter can be filled with nonalcoholic beverages,1
a paper clip has a sharp point .,paper clips have a rounded tip,1
a lightning has a diameter .,a lightning caused by static electricity has a length,1
an herbivore is able to consume a plant .,a dog is able to eat plants,0
a ladle is used to fill a cup .,a ladle of milk can be used to pour a cup of milk,0
an exhaust fan has a fan blade .,a non-operating exhaust fan has an exhaust blade,1
sparrows is found in open areas .,a black sparrow can be found in an open field,0
bulldozers are used for construction .,an earth mover can be used for earthmoving,0
bulldozers are used for construction .,an earth mover is used for digging trenches,0
wall fans have a fan blade attached to them .,an oscillating fans have a blade that rotates,0
a juniper is found growing in a forest .,a juniper bush can be found growing in the forest,0
wild pigs are a nuisance .,a wild boar can be a source of food,1
a zebra fish have the ability to swim .,black zebra fish have a swimming ability,0
a gun is used to commit a crime .,a gun that shoots rubber bullets can be used to rob a bank,0
a zebra fish have the ability to swim .,a zebra fish with orange stripes have a swimming ability,0
wild pigs are a nuisance .,boars can be a danger to livestock,0
an arrangement is made with the landlord to pay rent .,a bouquet of flowers can be made to be delivered to the tenant,0
a alligator is a reptile .,a large alligator is not a snake,0
aloe is used to treat dry skin .,an aloe plant is used to treat wounds,1
nitrous oxide is a gas .,nitrous oxide from a pressurized bottle can be inhaled through a straw,0
an electrocardiogram must be taken to confirm a heart attack .,an electrocardiogram of a sick man must be taken to see if the heart is beating normally,1
weed is sold .,"weed should be stored in a cool, dry place",1
an ice creams are made from a mixture .,strawberry ice creams can be made from frozen strawberries,1
aloe is used to treat dry skin .,aloe vera plant can be used to reduce inflammation,1
a dilator is found in a medical clinic .,a stainless steel dilator can be found in a doctor's office,0
bumpers are made of metal .,a bumpers for a car can be made of a metal,0
skunks should be left alone .,brown skunks should be left to fend for themselves,0
technologies are developed to address specific problems .,newer technologies can be developed to solve new problems that arise,0
a will is filed with the county probate court .,a notary public's will can be filed with a county court,0
"hair gels produce a smooth , shiny surface .",salon brand hair gels produce a shiny finish,0
technologies are developed to address specific problems .,a wind turbine can be developed to produce electricity when the wind blows,0
an ova is fertilized .,a fertilized ova is capable of dividing,0
botany is used to identify plants that are poisonous to humans .,a carnivorous plant should not be used to feed pets,0
a puffin should be able to fly .,young puffins should be able to swim,1
"bay leaves are used to flavor soups , stews , or sauces .",bay leaves are used to flavor meats,1
a stamp produces an impression .,a die-cut stamp produce a design,1
a red banana is a banana .,unripe red bananas can be picked and eaten,0
"bay leaves are used to flavor soups , stews , or sauces .",fresh bay leaves can be used to flavor meats,1
an ill patient are referred to a hospital .,an ill patient is referred to a doctor,1
bulldozers are used to clear land to make way for new housing .,a front-end loader is used to clear a field,0
Screws have a tendency to loosen .,square-headed screws have more threads,0
constipation is treated with laxatives .,constipated constipated constipated constipation is treated with stool softeners,0
a gun is designed to be used .,semi-automatic guns are not designed to kill people,0
a germination has to occur in the soil .,germinating seeds have to be exposed to light,1
Screws have a tendency to loosen .,single-threaded self-tapping screws have the tendency to come loose,0
assets are valued at their fair market values .,a piece of art can be valued at any price,1
Molluscs have been around for a very long time .,snakes have been around for hundreds of thousands of years,0
ice creams are sweetened with sugar .,a strawberry-vanilla ice cream can be sweetened with vanilla sugar,0
Molluscs have been around for a very long time .,octopus have been around for millions of years,0
inflammatory diseases are caused by the body's own immune system attacking itself .,rheumatoid arthritis can be caused by an overactive immune system,0
"remote controls has buttons , switches , or dials .",a universal remote control has buttons and a dial,0
a riverbanks has many different species .,a yellow river has many species of fish,1
a small computer is a microcomputer .,a personal computer is also referred to as a computer,0
coasters are made of wood .,a coaster made of wood can be made of many different woods,0
a riverbanks has many different species .,a shore of a large lake has many kinds of fish,0
a triage is found in a hospital's emergency department .,a triage of congestive heart failure is found in the emergency department of a hospital,0
a spare tire is used to replace a worn tire .,a spare tire can be used to repair a puncture,1
"lactose intolerance produces bloating , cramping .","lactose intolerance with gastrointestinal side effects produces nausea, vomiting",1
"an air pollution are caused by emissions from vehicles , factories , power plants , etc .",pollution of the air can be caused by the burning of fossil fuels,0
spaceships have some sort of power .,starcruisers have shields and armor,1
a ringtail has a tail .,a ringtail has a mouth,1
horses is trained to do almost anything .,a thoroughbred can be trained to pull a car,0
a puffin should be able to fly .,young puffins should be able to swim,1
policies must be passed by both houses of Congress .,anti-drug policies must be passed by the states,1
telephones are used to communicate with the outside world .,a mobile phone can be used to send and receive text messages,0
horses are bred to be ridden .,a stallion is bred for speed,0
natural selection is a good thing .,a multicellular organism should not be treated like a single cell,0
paramecia is found in the wild .,paramecium can be found in aquaria,0
spaceships have some sort of power .,collector's edition spaceships have a collector,0
hoes have been used to plow fields .,pole hoes have been used to plow cornfields,0
spaceships have some sort of power .,interplanetary spaceships have a lot of fuel,0
a riverbank is a place .,a small riverbank can be a lot of fun,0
"cudgels is made of metal , wood , or other materials .",wooden cudgels can be made of birch or oak,0
an annuity is removed from an individual's IRA .,an income-producing annuity can be removed from an individual's account,0
a ill patient is placed on a ventilator to help with breathing .,an ill patient can be placed on a feeding tube,0
fabric softener is a chemical softener .,a bottle of fabric softener can be mixed with water,0
an advertisement is placed on a website .,an advertisement for sunglasses can be placed on an online retailer's website,0
mango trees are grown for their fruit .,young mango trees can be grown for fruit production,0
