sentence1,sentence2,label
a plant hormone is present in the plant tissue .,gibberellins are present in the soil,1
a scalpel produces a cut .,a miller's anesthetizing scalpel produces the cut,0
mango trees are grown for their fruit .,a mango tree with ripe mangoes is grown for the mangoes,0
ill patients must be admitted to the hospital .,ill patients must be admitted to intensive care,0
a hedge shears are used for trimming .,a well-cared-for hedge shears can be used for pruning,1
a ground beetle is found on the ground .,beetles can be found on tree trunks,1
a hedge shears are used for trimming .,a hedge shears with a blade guard can be used for pruning branches,0
coconut milk has a slight coconut flavor .,a full-fat coconut milks has a hint of coconut,0
a chest pain should be a warning .,chest pains caused by indigestion should be taken seriously,1
technologies are designed to be used for a specific purpose .,a sewing machine is designed to sew garments,0
a zebra fish is found swimming in a tank .,a fish of the minnow family can be found in a fish tank,0
pressure cookers is set to high .,a pressure cooker that cooks rice can be set to high heat,1
an electrocardiogram must be taken to confirm a heart attack .,an electrocardiogram of a sick man must be taken to see if the heart is beating normally,0
sand dollars have been known to be found on the beaches .,a flat sand dollar have been known washed up on the beach,0
"hair gels produce a smooth , shiny surface .",salon brand hair gels produce smooth and shiny hair,0
amino acids produce structural changes in proteins .,amino acids produce reactive oxygen species,1
sand dollars have been known to be found on the beaches .,a living sand dollar have been known to wash ashore,1
guns is used to commit a crime .,a semi-automatic rifle can be used to commit a violent crime,0
hoes have been used to plow fields .,witch's hoes have been used to clear fields,0
dvd players are connected to a television via HDMI .,a dvd player with surround sound can be connected to an HDTV via HDMI,0
license plates are issued to vehicles .,a specialty license plate can be issued to a motor vehicle,0
coconut milk has a slight coconut flavor .,full-fat coconut milk has more flavor,1
drummers are taught to play with their hands .,tambourine players can be taught to improvise,0
coconut milk has a slight coconut flavor .,coconut milks have a high fat content,0
detergents have a strong scent .,laundry detergents have chemicals that can irritate the skin,0
a roof can only be installed on a structure .,a shingled roof can be installed on a building,0
stairs are used to ascend .,a staircase with a banister can be used to climb to the top,0
detergents have a strong scent .,anti-bacterial detergents have a strong smell,0
an weaver should be able to make a decent living .,a weaver of rugs should be able at least to get by,0
an iron deficiency is treated with iron supplementation .,iron deficiency anemia can be treated with iron supplements,0
wild turkeys is killed for their feathers .,a common wild turkey can be killed for the feathers,0
paper clips are used to hold paper in place .,common paper clips can be used to attach paper to other objects,1
a trembling is an involuntary spasm of the muscles .,a slight tremor is an involuntary spasm of the nerves,0
paper clips are used to hold paper in place .,a paper clip made from brass can be used to secure a piece of paper,0
"Most mammals have a central nervous system , which controls body movements .",giraffes have a long neck,1
telephones are used to communicate with the outside world .,a cellular telephone can be used to send and receive text messages,0
lactose intolerances have to do with an intolerance to lactose .,severe lactose intolerances have to be treated with a lactase enzyme,0
telephones are used to communicate with the outside world .,a landline phone is used to make phone calls,0
skunks should be left alone .,a black skunk should be left at home,0
skunks should be left alone .,brown skunks should be left to fend for themselves,0
a hair gel is meant to be applied to the hair .,a can of hair gel is meant to be used on the head,0
newborn babies have a hard time sleeping .,newborn babies have a high risk of SIDS,0
a telephone booth is a public place .,a telephone booth can be located in a private residence,1
hotel rooms are equipped with a microwave .,bathtubs are equipped with a shower head,0
an electrical connection is used to connect a device to an external power source .,a 3-prong plug is used to provide a ground connection,0
"a conflict are resolved through diplomacy , negotiation , or military action .",a military conflict between two countries is resolved through diplomatic means,0
an electrical connection is used to connect a device to an external power source .,a battery can be used to store electricity,0
family pets are predisposed to certain health issues .,dogs can be predisposed to heart disease,0
family pets are predisposed to certain health issues .,cats are predisposed to certain types of cancer,0
ambulances can only take patients to the nearest hospital .,vans take people to the police station,0
ambulances can only take patients to the nearest hospital .,blue ambulances take passengers to the airport,1
a will is used to transfer property to a beneficiary .,a last will and testament can be used to establish a trust,1
constipation is treated with laxatives .,constipation caused by stress can be treated with the use of a laxative,0
constipation is treated with laxatives .,constipation should be treated with diuretics,1
a concert hall can only hold so many people at any given time .,opera houses hold thousands of people at a time,0
a concert hall can only hold so many people at any given time .,philharmonic halls hold hundreds of thousands of people,0
a chest pain has several causes .,a man having a heart attack has a blockage in the heart,0
a chest pain has several causes .,a chest pain from a heart attack have many reasons,0
Pressure cookers are a great way to cook large batches .,a double-boiler pressure cooker is a great way for a single person to cook,1
Pressure cookers are a great way to cook large batches .,non-stick pressure cookers are a great way for a family to make a large batch of chili,0
hockey is a game .,a slapshot can be deflected,0
an asset has a value .,a family business has an income,0
skunks produce an odor .,"spotted skunks produce a strong, musky odor",0
skunks produce an odor .,small skunks produce a high volume of urine,0
Chimpanzees have been shown to be able to use tools .,apes have been shown to engage in complex social interactions,0
Chimpanzees have been shown to be able to use tools .,chimpanzee have been shown to engage in complex social interactions,0
"a livestock is "" in distress "" if it is unable to feed itself .",a bovine is a mammal that is capable of producing milk,0
ambulances has to make multiple trips to the scene .,an ambulance has to go to the hospital,0
ambulances has to make multiple trips to the scene .,an ambulance with a siren has to pull over,0
periodontal disease produces inflammation of the gum .,gingivitis produces gingival inflammation,0
"cudgels is made of metal , wood , or other materials .",a wooden cudgel can be made of hardwood,0
an x - ray is used to look inside the body to see what's wrong .,an x - ray of the foot can be used to determine if the foot is broken,0
a detergent is applied to the skin to cleanse .,a detergent can be applied to clothing to remove stains,1
wall fans have a fan blade attached to them .,oscillating fans have a fan motor,0
atoms have a mass .,an atom of hydrogen have a charge,1
wall fans have a fan blade attached to them .,humidifiers have been used,0
a gun are used for hunting .,a semi-automatic shotgun can be used for home defense,1
a asset has a market value .,a mass of gold has a price,0
a hippopotamus is found in the wild .,a gazelle is found in some parts of Africa,0
a asset has a market value .,a number of gold bars have a market price,0
natural selection has favored individuals who are able to adapt to new environments .,a bird has favored the ability to migrate to new areas,0
a painting should be about the artist's vision .,a painting of a flower should be about the artist's vision of the flower,0
a bugle is used to signal an attack or retreat .,a corn-based bugle can be used to call a battle,0
a defense attorney should be able to get a conviction .,a defense attorney should be able defend the client,1
periodontal disease produces inflammation of the gums .,lupus erythematosus produces gingivitis,1
a desert plant must be able to survive in very dry conditions .,a tall desert cactus must be able withstand extreme temperatures,0
a desert plant must be able to survive in very dry conditions .,a tall desert cactus must be able withstand the dryness of the desert,0
a jet should be able to land on the runway .,a passenger jet should be able to take off and land on a runway,0
hair is removed with a razor blade .,a hair from a non-domesticated animal is removed with the blade of a razor,0
hair is removed with a razor blade .,hair can be removed with a pair of scissors,1
a strawberry is a berry .,a strawberry plant can be thought of as a fruit,0
"Pressure cookers is tricky to use , especially if you're new to them .",pressure cookers can be tricky to clean,1
lactose intolerances have to do with an allergy to lactose .,a lactose intolerance (congenital) have to be treated,0
Telephone booths are a common sight .,cell phones can be used to send text messages,0
lactose intolerances have to do with an allergy to lactose .,an intolerance to goat's milk have to deal with,0
a walleye is caught by anglers who cast their line from the shore .,walleyes can be caught by anglers casting from the beach,0
crockery can consist of many different types of materials .,crockery made in india consist of different styles,0
Stomachs are an important part of the body .,a full stomach is an important part of a person's digestive system,0
"a lactose intolerance produces symptoms that include bloating , gas .",a lactose-intolerant produces diarrhea and/or constipation,1
a water heater is connected to a water source .,a low-flow water heater can be connected to the same water supply,0
"a lactose intolerance produces symptoms that include bloating , gas .","a lactose insufficiency produces diarrhea, nausea, and vomiting",1
a porpoise is found at sea .,harbor porpoises can be found at the coast,1
water heaters are used to heat water to a certain temperature .,an electric water heater can be used to boil water,0
a ladle is used to fill a cup .,a ladle is used to scoop food into a bowl,1
a painting should be placed on a flat surface .,a painting made of watercolors should be placed on an easel,1
a painting should be placed on a flat surface .,a painting made of watercolors should be placed on an easel or canvas,0
a wedding has a couple's name .,a caterer has a menu,0
entertainment is a distraction .,reading a book is a diversion,0
lorries are used to move goods from one place to another .,tractors are used to plough the land,0
a shoebox is a container .,a blue shoebox is a box with a lid,0
lorries are used to move goods from one place to another .,rickshaws are used to transport goods,0
a ringtail has a tail .,a white-tailed ringtail has a head,1
natural selection is the process by which organisms adapt to changing environments .,natural selection can be the process that creates new species,1
natural selection is the process by which organisms adapt to changing environments .,a natural selection of the fittest can be the process through which a species adapts to a changing environment,0
sea ice is thin enough to break up .,frozen sea ices can be thin on top,0
"a conflict is resolved through negotiation , mediation or arbitration .",internal conflicts can be resolved through the use of mediation,0
"aloe is used to treat mild to moderate skin conditions , including acne .",aloe barbadensis can be used to treat rosacea and psoriasis,0
concert halls should be equipped with a soundproofing system .,a stadium should be equipped with a system that can block out the noise of the crowd,0
sea ice is thin enough to break up .,sea ice that floats can be thin enough to melt,0
a grizzly bear is observed in the wild .,a very large grizzly bear can be observed in a zoo setting,1
a water parks have a large pool .,an aqua park have a large swimming pool,0
a grizzly bear is observed in the wild .,a very large grizzly bear is observed in Yellowstone National Park in the United States,0
a lactose intolerance is caused by an intolerance to lactose .,a dairy allergy can be caused by an allergy to cow's milk,0
a herbivores have to eat plants .,dogs have to drink water,0
an will should be drafted by a qualified attorney .,a last will and testaments should be drafted by an experienced estate planning attorney,0
pressure cookers is set to high or low temperatures .,a 6-quart pressure cooker can be set to medium or high pressure,1
an abbey is a place where people come to worship God .,a monasteries is a place of worship,0
pressure cookers is set to high or low temperatures .,a pressure cooker that cooks rice can be set to medium or high pressure,1
mesh skimmers have been used to steal credit card information from retailers .,stainless steel skimmers have been used to siphon money from ATMs,1
a daybooks can consist of several pages .,a daybook of names and addresses consist of one or more pages,1
dvd players are connected to a television via HDMI .,a dvd player with surround sound can be connected to the television via HDMI,0
a tennis ball produces a sound .,a tennis ball that is very soft produces a high pitched sound,0
an abbey should have an abbess .,a monasteries should have monks and nuns,0
periodontal disease produces inflammation of the gums .,lupus erythematosus produces inflammatory changes in the joints,0
cameras are used to take photos of people .,a video camera is used to record video,1
a puffin should be able to fly .,a small puffin should be able to fly well,0
a cottonmouth should be able to swim .,a water moccasin should not be able to walk,0
a cookbook is purchased .,a cookbook about cooking can be purchased from a store,1
a ladle is used to fill a cup .,a ladle is used to fill a coffee cup,0
a puffin should be able to fly .,a large puffin should be able fly at least 20 metres,0
aloe is a natural moisturizer .,an aloe vera plant with leaves can be toxic to dogs and cats,0
lorries are used to transport goods from one point to another .,a big lorry is used to move goods from a factory to a warehouse,0
a trembling is an involuntary spasm of muscles .,a trembling caused by cold is an involuntary spasm of the extremities,0
a zebra fish is found swimming in a tank .,a zebra fish with stripes can be found in a pond,1
Cameras should be able to see .,a video camera should be able to record video,1
botany is used to identify plants .,botany is used to identify animals,1
a weed is an invasive species if it displaces native plant species .,dandelion leaves can be toxic to dogs and cats,0
a wedding have a reception hall .,a traditional wedding have a reception pavilion,0
an advertisement is placed on a website .,an advertisement for hair-care product is placed on a newspaper,1
an apple must be ripe to be eaten .,a yellow apple must be ripe to be picked,0
a helmet has a visor .,a helmet with a face guard has a shield,1
a salad spinner is a device used to spin salad leaves .,a ceramic salad spinner is a device that is designed to spin a salad leaf,0
air pollution are caused by burning fossil fuels in power plants .,"global air pollution can be caused by cars, trucks and planes",1
screws are used to fasten two pieces of metal together .,a phillips-head screw can be used to join two metal pieces together,0
a lactose intolerance is a problem .,a lactose intolerant is a person who can't digest lactose,0
a sweet potato is cooked until it's soft .,a sweet potato plant can be cooked until the skin turns brown,0
salad spinner are used to remove excess water from salads .,a top-shelf salad spinner can be used to scoop out the water from a salad,0
an administration has a duty to protect its citizens from harm .,a british government has a right to defend itself against terrorist attacks,0
a pancreas are found in the abdominal cavity .,insulin-secreting cells can be found in the walls of the small intestine,0
a hair clips is found in the hair salon .,a hair clip made from tortoiseshell can be found in hair salons,0
ice cream should be stored in the refrigerator .,chocolate ice creams should be stored in the freezer,1
a bluetooth speakers have a volume control .,a set of bluetooth speakers have an on/off switch,1
a bluetooth speakers have a volume control .,bluetooth speakers have a speakerphone,1
"a backhoe is fastened to a truck , which can then be used to dig trenches .",a backhoe can be fastened to the ground,1
"a backhoe is fastened to a truck , which can then be used to dig trenches .",backhoes can be fastened to the back of a bulldozer,1
"scenes is set in the past , present , future .",scenes can be set to play in reverse,0
stocks is expected to go up .,stocks are expected to continue to rally,0
"Remote controls is used to adjust the volume , play , pause , next track , previous track , skip forward / back",remote controls can be used to change the current track,0
Coconut milk is found in most grocery stores .,coconut milk is found in natural food stores,1
Coconut milk is found in most grocery stores .,coconut milk is found in health food stores and natural food stores,1
a wild pig is a wild animal .,a wild pig should not be confused with a domestic pig,0
a wild pig is a wild animal .,wild pigs can be domesticated and bred,1
lorries should only be used to transport people or goods .,lorries should be used to transport heavy goods only,1
lorries should only be used to transport people or goods .,lorries should be used to transport heavy goods,0
alligators are found in Florida .,alligators can be found in other parts of the world,1
a submarines are designed to operate for a long time .,submarines are designed to operate in a hostile environment,0
a submarines are designed to operate for a long time .,submarines are designed to operate in shallow water,0
a newspaper is willing to publish a story .,a dailies are willing to pay for advertising,0
a newspaper is willing to publish a story .,a school newspaper should be willing to print a report,0
a crabapples is eaten fresh or dried .,"crabapples can be eaten raw, cooked, or canned",1
a crabapples is eaten fresh or dried .,"crabapples can be eaten raw, cooked or frozen",1
a toy chest is opened .,a toy chest can be used to store items,1
a toy chest is opened .,a toy chest can be closed and locked,1
coconut milk has a higher fat content than other milks .,coconut milks have a lot of protein,0
Inflammatory diseases has multiple causes .,inflammatory diseases have a common underlying pathophysiology,1
a water park is a place where you go to relax .,a water park is a place where people come to have fun,1
a water park is a place where you go to relax .,a water park can be a place to meet new people,0
a recital is a musical composition if its main purpose is to convey information .,an extravaganza can be described as a performance,0
lightnings are associated with thunder .,lightnings can be associated with lightning bolts,1
lightnings are associated with thunder .,lightnings can be associated with lightning strikes,1
Painting is a great way to express your creativity .,painting can be a great way for kids to learn about color theory,1
Painting is a great way to express your creativity .,painting is a great way to learn,1
a paper clip has a sharp point .,a paper clip has the ability to bend,0
bulldozers are used for construction .,bulldozers can be used for excavating,1
bulldozers are used for construction .,bulldozers can be used for mining and quarrying,1
a desert plant is a plant .,an agave should not be confused with a chile pepper,0
a desert plant is a plant .,agaves are a type of agave,0
a zebra fish have the ability to swim .,zebra fish have a sense of touch,1
a zebra fish have the ability to swim .,zebra fish have a sense of smell,1
an arrangement is made with the landlord to pay rent .,a contrivance can be made to collect rent from the tenant,1
an arrangement is made with the landlord to pay rent .,a contrivance is made to collect the rent from the tenant,0
aloe is used to treat dry skin .,aloe should not be used to dry out the skin,0
aloe is used to treat dry skin .,aloe vera can be used to help heal wounds,1
technologies are developed to address specific problems .,technologies can be developed to solve a broader range of problems,1
"bay leaves are used to flavor soups , stews , or sauces .",bay leaves can be used to season meat and poultry,1
"bay leaves are used to flavor soups , stews , or sauces .",bay leaves can be used to season meats and poultry,1
Screws have a tendency to loosen .,screws have to be installed in a specific order,0
Screws have a tendency to loosen .,screws have a lot of threads,0
Molluscs have been around for a very long time .,molluscs have been around a lot longer than humans,0
a register has a maximum size .,an accumulator has an upper limit,0
a register has a maximum size .,an index register has an upper limit,0
a riverbanks has many different species .,a riverbanks has many different forms,0
a spare tire is used to replace a worn tire .,a spare tire can be used to extend the life of a vehicle,1
a spare tire is used to replace a worn tire .,a spare tire is used to protect the vehicle from damage,0
policies must be passed by both houses of Congress .,policies must be passed by the states,0
spaceships have some sort of power .,spaceships have a lot of weapons,1
a riverbank is a place .,"a right riverbank can be a river, a lake or a stream",1
a riverbank is a place .,a left riverbank should not be confused with a right,0
sand dollars have been known to be found on the beaches .,sand dollars have been known be found in the water,1
detergents have a strong scent .,detergents have a strong taste,1
paper clips are used to hold paper in place .,paper clips can be used to attach paper to other objects,1
telephones are used to communicate with the outside world .,telephones can be used to make phone calls,0
skunks should be left alone .,skunks should be left outside at night,0
skunks should be left alone .,skunks should be left out of reach of children,0
hotel rooms are equipped with a microwave .,hotel rooms are equipped with an air conditioner,1
hotel rooms are equipped with a microwave .,hotel rooms are equipped with refrigerators,1
an electrical connection is used to connect a device to an external power source .,an electrical connection is used to communicate with a computer,0
family pets are predisposed to certain health issues .,family pets can be predisposed to other health conditions,0
family pets are predisposed to certain health issues .,family pets can be predisposed to other health problems,1
ambulances can only take patients to the nearest hospital .,ambulances take time to arrive,0
constipation is treated with laxatives .,constipation should be treated with an antispasmodic,1
constipation is treated with laxatives .,fecal impactions should be treated with a liquid laxative,0
a concert hall can only hold so many people at any given time .,concert halls hold a lot of people,0
a chest pain has several causes .,an angina pectoris does not have to be caused by a heart attack,0
a chest pain has several causes .,a chest pains has different symptoms,0
Pressure cookers are a great way to cook large batches .,pressure cookers are a great way for home cooks to save money,1
hockey is a game .,power hockey can be played with one stick,0
hockey is a game .,table hockey is a fun game,0
skunks produce an odor .,skunks produce a chemical called skunk spray,1
skunks produce an odor .,skunks produce high levels of ammonia,1
Chimpanzees have been shown to be able to use tools .,chimpanzees have been shown to engage in complex social interactions,1
ambulances has to make multiple trips to the scene .,ambulances have to transport patients to the hospital,0
wall fans have a fan blade attached to them .,wall fans have a fan controller,0
wall fans have a fan blade attached to them .,wall fans have a fan motor,1
a asset has a market value .,working capital has an intrinsic value,0
a asset has a market value .,a return on assets have a return,0
natural selection has favored individuals who are able to adapt to new environments .,natural selection has favored the ability to learn new skills,1
natural selection has favored individuals who are able to adapt to new environments .,natural selection has favored the development of new genes,0
a defense attorney should be able to get a conviction .,a defense attorney should be able defend the client,1
a desert plant must be able to survive in very dry conditions .,agaves must be able to tolerate high temperatures,1
a desert plant must be able to survive in very dry conditions .,an agave must be able grow in a desert environment,0
hair is removed with a razor blade .,ingrown hairs can be removed with tweezers,1
hair is removed with a razor blade .,an ingrown hair can be removed with the blade of a razor,0
crockery can consist of many different types of materials .,dishes consist of many different materials,0
crockery can consist of many different types of materials .,a dish consist of many different kinds of ingredients,0
Stomachs are an important part of the body .,stomachs are an important part of digestive processes,0
Stomachs are an important part of the body .,stomachs are an important part of digestive systems,0
