sentence1,sentence2,label
"a lactose intolerance produces symptoms that include bloating , gas .",a lactose intolerance produces a burning sensation in the mouth and throat,1
a green vegetable is eaten .,a broccoli can be eaten as a vegetable,0
lorries are used to move goods from one place to another .,lorries can be used to transport passengers,1
natural selection is the process by which organisms adapt to changing environments .,natural selection is the process by which populations of organisms change,0
natural selection is the process by which organisms adapt to changing environments .,natural selection can be the process that creates new species,1
sea ice is thin enough to break up .,drift ice is thin enough to move,0
sea ice is thin enough to break up .,drift ice is thin enough to melt,1
pressure cookers is set to high or low temperatures .,pressure cookers can be set to a specific time,1
pressure cookers is set to high or low temperatures .,pressure cookers can be set to a specific cooking time,0
dvd players are connected to a television via HDMI .,dvd players can be connected to an HDTV via HDMI,0
